{
  "schema": "programmable-v4-migration-allocations/v1",
  "targetChainId": 4663,
  "targetTokenDecimals": 18,
  "ordering": "targetLowercaseAsciiAscending",
  "recipientCount": 310,
  "totalRaw": "755738416021526951788414688",
  "totalDecimal": "755738416.021526951788414688",
  "orderedAllocationSha256": "3ba2c483ccbdce333c106e4ecb7b68785f566bfec79d7d5e19c07dd9085d1f43",
  "recipients": [
    {
      "index": 0,
      "target": "0x0066bf82d1BC5238B5651595e184f20C6522a04B",
      "amountRaw": "1179803273471700420828344",
      "amountDecimal": "1179803.273471700420828344"
    },
    {
      "index": 1,
      "target": "0x00E126d9723Bb6133bdfdf11dD19bbd444718536",
      "amountRaw": "191760205493135877482852",
      "amountDecimal": "191760.205493135877482852"
    },
    {
      "index": 2,
      "target": "0x016311EDC15b3964dB73416529650BF2aeAdBd25",
      "amountRaw": "4737908334839738803172",
      "amountDecimal": "4737.908334839738803172"
    },
    {
      "index": 3,
      "target": "0x01C1BCe151C47dCD29037B6723B4acF0eDD26970",
      "amountRaw": "146317825488495194579524",
      "amountDecimal": "146317.825488495194579524"
    },
    {
      "index": 4,
      "target": "0x01fB473E371A546021BA53c0588F04293Ded2101",
      "amountRaw": "235536000000000000000000",
      "amountDecimal": "235536.000000000000000000"
    },
    {
      "index": 5,
      "target": "0x02B4058eDaB6125045B65f5734A79399934EB86d",
      "amountRaw": "10570407601641312452716120",
      "amountDecimal": "10570407.601641312452716120"
    },
    {
      "index": 6,
      "target": "0x02dd400392Db31Dc3ea5Bb910c986c51D90a2001",
      "amountRaw": "7041720775519538980861466",
      "amountDecimal": "7041720.775519538980861466"
    },
    {
      "index": 7,
      "target": "0x030582ceccb1d1F33A2b5B62AA97C1ef11374C87",
      "amountRaw": "42279931997284080081129",
      "amountDecimal": "42279.931997284080081129"
    },
    {
      "index": 8,
      "target": "0x03dF40F690A55986A8FC88ad19eeCaAf229c248D",
      "amountRaw": "46107582991337994807257",
      "amountDecimal": "46107.582991337994807257"
    },
    {
      "index": 9,
      "target": "0x03Edd76C30398a47B61857138D1197Cad32Db02f",
      "amountRaw": "761963393426232282602656",
      "amountDecimal": "761963.393426232282602656"
    },
    {
      "index": 10,
      "target": "0x03FDef14113fFCe886A4B61FA08A0C747E87aA96",
      "amountRaw": "7783533941174314228374328",
      "amountDecimal": "7783533.941174314228374328"
    },
    {
      "index": 11,
      "target": "0x04B436555Dc69Ea4Bf8BA50d8C591E60443B3fF9",
      "amountRaw": "576149036745802235520010",
      "amountDecimal": "576149.036745802235520010"
    },
    {
      "index": 12,
      "target": "0x05F70ac31057924F8aB5bD9C2FF8A511497371B0",
      "amountRaw": "7394128267650193379090252",
      "amountDecimal": "7394128.267650193379090252"
    },
    {
      "index": 13,
      "target": "0x07343Cf9331a7C79C809Ad358B0b7D2D83e871b6",
      "amountRaw": "768982994520728679591831",
      "amountDecimal": "768982.994520728679591831"
    },
    {
      "index": 14,
      "target": "0x0aCE0D1610B4fe70c282396DcbCAA43F9A52CF2D",
      "amountRaw": "1100000000000000000000",
      "amountDecimal": "1100.000000000000000000"
    },
    {
      "index": 15,
      "target": "0x0C49418D2074579E8843d2b556eB89aAAc67d7eC",
      "amountRaw": "1121382663745078498265517",
      "amountDecimal": "1121382.663745078498265517"
    },
    {
      "index": 16,
      "target": "0x0Ea4daC04898b55E3396B7E5BcA1CCca5AB62d7d",
      "amountRaw": "6050485734074150832641689",
      "amountDecimal": "6050485.734074150832641689"
    },
    {
      "index": 17,
      "target": "0x0f06A7BD1C8fF21B6C197f26cc19006d26F882d9",
      "amountRaw": "3138671080931344573628655",
      "amountDecimal": "3138671.080931344573628655"
    },
    {
      "index": 18,
      "target": "0x0f297a399D385AeB60Ca378C27Fd42082cC5C841",
      "amountRaw": "1681743698837813557699245",
      "amountDecimal": "1681743.698837813557699245"
    },
    {
      "index": 19,
      "target": "0x0F9a7a53B36DAF1F52fE7A616ea4b25C532d2fd2",
      "amountRaw": "7460231244727334714831335",
      "amountDecimal": "7460231.244727334714831335"
    },
    {
      "index": 20,
      "target": "0x10b9D7Be1e79eA681Facc778a4D02f8f3217610e",
      "amountRaw": "123305660001479051949063",
      "amountDecimal": "123305.660001479051949063"
    },
    {
      "index": 21,
      "target": "0x11003f59FEf008aa0A9380E9DDdC3A46351B4Dd4",
      "amountRaw": "688316162198590655902971",
      "amountDecimal": "688316.162198590655902971"
    },
    {
      "index": 22,
      "target": "0x110337b57a2A00043AA7b5e8dF4f87AA558F4BAa",
      "amountRaw": "713644664342216165599045",
      "amountDecimal": "713644.664342216165599045"
    },
    {
      "index": 23,
      "target": "0x11564Fd96dF2bDCD11326e070Ea6bb54d9951fc8",
      "amountRaw": "342802214580492417186377",
      "amountDecimal": "342802.214580492417186377"
    },
    {
      "index": 24,
      "target": "0x11778175533E0eeb523c6AB4E2Bb0A4962ca90b6",
      "amountRaw": "10951180471410974470390",
      "amountDecimal": "10951.180471410974470390"
    },
    {
      "index": 25,
      "target": "0x11De370c804DeB36AB79403F164dFA24F76e5c7A",
      "amountRaw": "90322454180987214091428",
      "amountDecimal": "90322.454180987214091428"
    },
    {
      "index": 26,
      "target": "0x125f76e49889a00F0213948f9f9d3AeB17b6627B",
      "amountRaw": "2984685715717456730677073",
      "amountDecimal": "2984685.715717456730677073"
    },
    {
      "index": 27,
      "target": "0x12aF4F24c30Ae4FfF17F997b913A443a45eb5ae6",
      "amountRaw": "13132139315038611763619987",
      "amountDecimal": "13132139.315038611763619987"
    },
    {
      "index": 28,
      "target": "0x12Bb0Ab73B5149645580f542dfC3C403Bd0a0cfd",
      "amountRaw": "1043891439743491502863844",
      "amountDecimal": "1043891.439743491502863844"
    },
    {
      "index": 29,
      "target": "0x131bb0a3DEFA4DEe1861c8d3fC486F61c769D7B3",
      "amountRaw": "14582776452027095319917009",
      "amountDecimal": "14582776.452027095319917009"
    },
    {
      "index": 30,
      "target": "0x13ec86DC7971e45067BB6cAA3fB9334C91709E16",
      "amountRaw": "288098556779194358669891",
      "amountDecimal": "288098.556779194358669891"
    },
    {
      "index": 31,
      "target": "0x1594412AB222A7079098C265B17807eAFe8A3CaF",
      "amountRaw": "393473750221045727001614",
      "amountDecimal": "393473.750221045727001614"
    },
    {
      "index": 32,
      "target": "0x15eAfc29816B34FB8B15dc6727a26DE4c4CB2df0",
      "amountRaw": "5070860767424953462219706",
      "amountDecimal": "5070860.767424953462219706"
    },
    {
      "index": 33,
      "target": "0x162277F7e858eccD83813Aa4D9417DE5fd3f2b72",
      "amountRaw": "884371857527735458350832",
      "amountDecimal": "884371.857527735458350832"
    },
    {
      "index": 34,
      "target": "0x1664dcB1539a3Eb2157fa8D955903A0c841EF1b1",
      "amountRaw": "6257061572934099612925",
      "amountDecimal": "6257.061572934099612925"
    },
    {
      "index": 35,
      "target": "0x16F554beb6c4F08Ed4c29cef13DCeA56A153999A",
      "amountRaw": "16211534990707644404114",
      "amountDecimal": "16211.534990707644404114"
    },
    {
      "index": 36,
      "target": "0x16F5EF133d0D15B196A778d22BF1ec56f8f37C05",
      "amountRaw": "20000000000000000000000000",
      "amountDecimal": "20000000.000000000000000000"
    },
    {
      "index": 37,
      "target": "0x17650c8dDbd4556A0B651bF7fa7cD449076cABB1",
      "amountRaw": "57632006826128325474948",
      "amountDecimal": "57632.006826128325474948"
    },
    {
      "index": 38,
      "target": "0x17fb03925aCEC7A799022ad5e268d2F27E9748b3",
      "amountRaw": "10000000000000000000000000",
      "amountDecimal": "10000000.000000000000000000"
    },
    {
      "index": 39,
      "target": "0x1847Dc422b9DeA349e8Af7d02CB3A136CD81F441",
      "amountRaw": "864411343074343182376397",
      "amountDecimal": "864411.343074343182376397"
    },
    {
      "index": 40,
      "target": "0x1927a547963A39813bD2Ab2982F08B469CFdD62A",
      "amountRaw": "3479758114560098573222473",
      "amountDecimal": "3479758.114560098573222473"
    },
    {
      "index": 41,
      "target": "0x1944D7A35fDE8A866357048E4082d2B06884F5ae",
      "amountRaw": "3922253207747337211970203",
      "amountDecimal": "3922253.207747337211970203"
    },
    {
      "index": 42,
      "target": "0x1Aa693723350a596C700e8Dfa5195aC86e2a5177",
      "amountRaw": "129567385464137263676063",
      "amountDecimal": "129567.385464137263676063"
    },
    {
      "index": 43,
      "target": "0x1BA1EaC0C322d856D6F8a71Fd6b0E63de6f296AD",
      "amountRaw": "1260238895944928292165",
      "amountDecimal": "1260.238895944928292165"
    },
    {
      "index": 44,
      "target": "0x1c0cB4Da14271538b73Aae73518C82B4374916De",
      "amountRaw": "38737673345135850597597",
      "amountDecimal": "38737.673345135850597597"
    },
    {
      "index": 45,
      "target": "0x1D2aE9C55Dc8BD75B157d9F786D143A3dA962854",
      "amountRaw": "407885078583913332655967",
      "amountDecimal": "407885.078583913332655967"
    },
    {
      "index": 46,
      "target": "0x1D9774d948A9fBa6520b1637A712756a72593455",
      "amountRaw": "4739824698420910636744396",
      "amountDecimal": "4739824.698420910636744396"
    },
    {
      "index": 47,
      "target": "0x1D9E67c1E9c418F8fcec4Ef92Da0b065f4727beA",
      "amountRaw": "349655764700805031095338",
      "amountDecimal": "349655.764700805031095338"
    },
    {
      "index": 48,
      "target": "0x1E540Ae9A8D796F95571BE8CAb69B725489eEe1c",
      "amountRaw": "1000000000000000000000000",
      "amountDecimal": "1000000.000000000000000000"
    },
    {
      "index": 49,
      "target": "0x1F333Aab7eb533b77da4b8989724708449D554BA",
      "amountRaw": "133884643559466424397400",
      "amountDecimal": "133884.643559466424397400"